{
  "progress_format_version": 1,
  "collection_id": "org.weave.character.collection.glasswind",
  "input_sha256": "65e68cfab4776ea450caae37e8990f207aa666399e0e94ae60e8e97c51bee67a",
  "request_sha256": "73503a919496292d1c927edcbcf9fdadb3bdb04f6230cdc907d69656610a3324",
  "total": 2,
  "next_index": 1,
  "completed_target_ids": [
    "org.weave.character.ari_vale"
  ],
  "state": "running"
}
